{
  "tradeId": "0x000000000000000000000000000000000000000000000000000000000000dEaD",
  "securityId": "0x9f6a3a7a5c51d3b5e2d7a9c3f0f0c3b1a2b3c4d5e6f708192a3b4c5d6e7f8090",
  "qty": "100",
  "currencyCode": "0x4555520000000000000000000000000000000000000000000000000000000000",
  "amount": "1000000000000000000000",
  "expiry": 1736200000,
  "party": 1,
  "nonce": "2",
  "signature": "0x"
}
